{
  "snapshot_id": "2026-01-20-120000",
  "timestamp": "2026-01-20T12:00:00Z",
  "version": "1.0.0",
  "source": {"type": "test_fixture"},
  "accounts": [
    {"account_id": "test-001", "account_name": "Test Account", "account_type": "taxable", "currency": "EUR"}
  ],
  "holdings": [
    {
      "security_id": "US0378331005",
      "isin": "US0378331005",
      "name": "Apple Inc.",
      "security_type": "stock",
      "quantity": 100,
      "currency": "USD",
      "account_id": "test-001",
      "market_data": {"market_value": 18000.00, "currency": "USD"}
    },
    {
      "security_id": "IE00B4L5Y983",
      "isin": "IE00B4L5Y983",
      "name": "iShares Core MSCI World UCITS ETF",
      "security_type": "etf",
      "quantity": 50,
      "currency": "EUR",
      "account_id": "test-001",
      "market_data": {"market_value": 4200.00, "currency": "EUR"}
    }
  ],
  "cash": [
    {"currency": "EUR", "amount": 1000.00, "account_id": "test-001"}
  ],
  "totals": {
    "total_market_value": 22200.00,
    "total_cash": 1000.00,
    "total_portfolio_value": 23200.00,
    "base_currency": "EUR"
  },
  "metadata": {"extraction_method": "test_fixture", "warnings": []}
}
